{
    "allTitles": "{\"en\":\"A Family\u2019s Experience\nwith COVID-19 at Home\"}",
    "author": null,
    "bookInstanceId": "3988905c-2540-456f-8aeb-6dbb43d5e07a",
    "bookLineage": "056B6F11-4A6C-4942-B2BC-8861E62B03B3,dd67bd4b-d16a-411b-81c4-dcd4af3fe6d3",
    "bookSamples": {
        "0": {
            "eng": "A Family\u2019s Experience\nwith COVID-19 at Home",
            "spa": ""
        },
        "1": {
            "eng": ""
        },
        "2": {
            "eng": "Easily understood and accurate guidance for families and communities who must care for COVID-19 patients at home without medical help."
        },
        "3": {
            "eng": ""
        },
        "4": {
            "eng": "A Family\u2019s Experience\nwith COVID-19 at Home",
            "spa": ""
        },
        "5": {
            "eng": "Lois W.\u00a0Varenkamp\n\nImages by Mark Marcuson, \u00a9 2021 SIL International. CC BY-NC 4.0."
        },
        "6": {
            "eng": ""
        },
        "7": {
            "eng": ""
        },
        "8": {
            "eng": "Adapted with permission from COVID-19 Home Based Care: How to do it best for the patient and the family, 2020, Difaem - German Institute for Medical Mission, www.difaem.\n\n\n\n\n\n\n\n\n\nThis resource has been developed using reputable public health sources for educational purposes only. It is not a substitute for professional medical advice. For questions or concerns about any topic described here, please consult a health professional.\n"
        },
        "9": {
            "eng": ""
        },
        "10": {
            "eng": ""
        },
        "11": {
            "eng": ""
        },
        "12": {
            "eng": "Anita and her family live in a small town. She loves her job as teacher but the school is closed because of the COVID-19 virus."
        },
        "13": {
            "eng": "At home, Anita has listened to radio programs and has learned a lot about the virus and how to keep\u00a0it from spreading."
        },
        "14": {
            "eng": "With all that she has learned Anita helps to teach her community how to keep themselves safe from the virus."
        },
        "15": {
            "eng": "\u00a0Even though going out and talking with lots of people increases her risk of getting the virus, she knows that it\u2019s important for everyone to know how to prevent the virus from spreading. She teaches her neighbors, \u201cWe must be careful to wash our hands often\"."
        },
        "16": {
            "eng": "Then she explains, \u201cWe need to wear masks when we\u00a0 leave our homes or when we are with people who do not live in the same house as us\"."
        },
        "17": {
            "eng": "\"We also must try to avoid spending lots of time with people outside of our own household\"."
        },
        "18": {
            "eng": "\"Also, we need to keep two meters away from other people when we shop, work or talk to neighbors\"."
        },
        "19": {
            "eng": "\"Doing these things will help to stop the virus from spreading from person to person\u201d."
        },
        "20": {
            "eng": ""
        },
        "21": {
            "eng": "One day, Anita doesn\u2019t feel well. She has a bad headache, a fever, and has begun to cough. Also, she notices that she cannot taste or smell her food. Anita realizes that she has Covid-19. "
        },
        "22": {
            "eng": "Right away she tells her family and says, \u201cWe all need to stay home and keep away from others. You might have the virus, too, even though you do not feel sick. You could easily spread the virus to others.\u201d"
        },
        "23": {
            "eng": "Then Anita goes and stays alone in a separate room, away from the family. She does not want to give them the sickness."
        },
        "24": {
            "eng": "Anita\u2019s husband, David, takes care of her. He brings her food and takes away the empty dishes. He keeps her dishes separate and only Anita uses them."
        },
        "25": {
            "eng": "David always wears a mask whenever he goes into her room. He also washes his hands every time he does anything for her. Anita also wears a mask when he comes into the room."
        },
        "26": {
            "eng": "The family shares one bathroom. So whenever Anita uses it, she always wears a mask.\u00a0"
        },
        "27": {
            "eng": "When she is done, she wipes down the bathroom with a disinfectant solution before going back to her room."
        },
        "28": {
            "eng": "After a couple of days, Marcos, Anita\u2019s 8 year old son, starts feeling bad too. Then her mother, who lives with them, develops a fever. They both move into the same room with Anita to try to keep the rest of the family safe.\n\nAnita\u2019s husband continues to be the only one in the family who brings food and cares for the three sick family members.\n\nThe room where Anita, her mother, and Marcos stay is small and crowded."
        },
        "29": {
            "eng": "Happily, it has a door to the outside. David sets up a place outside the door where the three sick family members can rest and enjoy the fresh air."
        },
        "30": {
            "eng": "Anita and David\u2019s daughters cook and do the laundry to help out."
        },
        "31": {
            "eng": "\u00a0Some neighbors bring groceries and fever medicines so that the family does not spread the disease by going to the shops themselves. They understand that even people who do not feel sick might have the virus and can spread the illness. They know it is important that Anita and David's whole family stays at home."
        },
        "32": {
            "eng": "David says to the neighbors, \u201cDo not come close to our sick family members! We do not want you to get sick, too. But please do pray for them, sing songs and visit with them from outside the enclosure.\u201d"
        },
        "33": {
            "eng": "The pastor comes every couple of days to pray for the sick, and encourage them by reading the Scriptures aloud from across the fence. He is careful to wear a mask as well."
        },
        "34": {
            "eng": "The Community Health Worker, Maria, has taught David how to care for his sick family. He knows to give them fever medicine when they need it.\n\nWhen they cannot eat much, he feeds them simple hot broth and soup. His daughters help by cooking the broth."
        },
        "35": {
            "eng": "His mother-in-law, Flora, gets so ill that she cannot eat anything."
        },
        "36": {
            "eng": "So, David\u00a0 mixes 8 teaspoons of sugar and 1/2 teaspoon of salt in a liter of clean water for Flora to drink. He tries to make sure that they all drink two liters of liquid per day."
        },
        "37": {
            "eng": "After several days of being very sick, Anita begins to feel better. Her son, Marcos, does not get very sick and recovers very quickly."
        },
        "38": {
            "eng": "Flora, Anita\u2019s mother, starts to feel better for a couple of days, too, but then she gets sicker again. Her fever goes up and she begins to have difficulty breathing.\n\nAnita is scared for her mother. She says to David, \u201cWe need to take Mama to the Doctor!\u201d\n\nDavid replies, \u201cI wish we could. But because of the lockdown there are no buses running. Even Maria, our Community Health Worker, can\u2019t come!\""
        },
        "39": {
            "eng": "Thankfully, Anita is able to call Maria on the phone to get some advice about how to take care of her mother."
        },
        "40": {
            "eng": "Maria tells her, \u201cRemember that all of you still need to quarantine from the rest of the community to keep from spreading the disease. There are ways you can help your mother even if you cannot go out.\u201d"
        },
        "41": {
            "eng": "She says to Anita, \u201cYou can now care for your mother since you have already had Covid-19 and it is unlikely that you will get it again right away. Also, Flora\u2019s room needs to be well-ventilated and she needs to keep drinking liquids\". Maria is glad to hear that the room has a door to the outside, which can be opened to let air inside.\n\nDavid opens the door and puts a screen curtain up so that the air can come in but the flies stay outside. When the door is shut, David makes sure the window is open because the fresh air helps Flora to breathe more easily.\n"
        },
        "42": {
            "eng": "Anita helps her mother take sips of water at least every hour."
        },
        "43": {
            "eng": "Anita learns from Maria to have her mother take some deep, slow breaths every hour. This helps Flora keep her lungs working properly."
        },
        "44": {
            "eng": "Anita also helps Flora change her position often. She tries to have Flora lie on her stomach whenever she can because that also helps Flora\u2019s lungs."
        },
        "45": {
            "eng": "Maria also teaches Anita another way to help Flora\u2019s lungs, by making a bubble bottle."
        },
        "46": {
            "eng": "First Anita fills a coke bottle with about 5 centimeters of water and puts a straw into the bottle."
        },
        "47": {
            "eng": "Then Flora blows gently into the straw to make the water bubble. Doing this several times every couple of hours helps her lungs work better."
        },
        "48": {
            "eng": "Anita is thankful for all of Maria's advice. Flora slowly begins to feel better and gets her strength back."
        },
        "49": {
            "eng": "The family keeps track of the days since Anita, Marco and Flora first got sick. Finally, after 14 days, they check their\u00a0temperatures. None of them have had a fever for at least 24 hours, and they are able to go out of the\u00a0house again.They will not spread the sickness anymore."
        },
        "50": {
            "eng": "Anita hopes she can see Maria, the Community Health Worker, again soon. She wants to thank her for all she\u2019s taught Anita and the rest of the community. David and Anita are glad to know that they took care of their family in the best possible ways even though they could not go and get medical help in person.\n\nMany others in their community have Covid-19. Anita and David have learned so much that now they can help them and their families."
        },
        "51": {
            "eng": "Their church has been able to encourage people by praying and bringing food. They also help with funerals of people who have died from the virus and give comfort to the grieving families and community."
        },
        "52": {
            "eng": "Everyone is looking forward to when they can get the vaccine to protect against Covid-19. Thankfully, while they wait, they know what to do."
        },
        "53": {
            "eng": ""
        },
        "54": {
            "eng": ""
        }
    },
    "bookText": {
        "eng": "A Family\u2019s Experience\nwith COVID-19 at Home\n\nEasily understood and accurate guidance for families and communities who must care for COVID-19 patients at home without medical help.\n\nA Family\u2019s Experience\nwith COVID-19 at Home\nLois W.\u00a0Varenkamp\n\nImages by Mark Marcuson, \u00a9 2021 SIL International. CC BY-NC 4.0.\n\n\nAdapted with permission from COVID-19 Home Based Care: How to do it best for the patient and the family, 2020, Difaem - German Institute for Medical Mission, www.difaem.\n\n\n\n\n\n\n\n\n\nThis resource has been developed using reputable public health sources for educational purposes only. It is not a substitute for professional medical advice. For questions or concerns about any topic described here, please consult a health professional.\n\n\n\n\nAnita and her family live in a small town. She loves her job as teacher but the school is closed because of the COVID-19 virus.\nAt home, Anita has listened to radio programs and has learned a lot about the virus and how to keep\u00a0it from spreading.\nWith all that she has learned Anita helps to teach her community how to keep themselves safe from the virus.\n\u00a0Even though going out and talking with lots of people increases her risk of getting the virus, she knows that it\u2019s important for everyone to know how to prevent the virus from spreading. She teaches her neighbors, \u201cWe must be careful to wash our hands often\".\nThen she explains, \u201cWe need to wear masks when we\u00a0 leave our homes or when we are with people who do not live in the same house as us\".\n\"We also must try to avoid spending lots of time with people outside of our own household\".\n\"Also, we need to keep two meters away from other people when we shop, work or talk to neighbors\".\n\"Doing these things will help to stop the virus from spreading from person to person\u201d.\n\nOne day, Anita doesn\u2019t feel well. She has a bad headache, a fever, and has begun to cough. Also, she notices that she cannot taste or smell her food. Anita realizes that she has Covid-19. \nRight away she tells her family and says, \u201cWe all need to stay home and keep away from others. You might have the virus, too, even though you do not feel sick. You could easily spread the virus to others.\u201d\nThen Anita goes and stays alone in a separate room, away from the family. She does not want to give them the sickness.\nAnita\u2019s husband, David, takes care of her. He brings her food and takes away the empty dishes. He keeps her dishes separate and only Anita uses them.\nDavid always wears a mask whenever he goes into her room. He also washes his hands every time he does anything for her. Anita also wears a mask when he comes into the room.\nThe family shares one bathroom. So whenever Anita uses it, she always wears a mask.\u00a0\nWhen she is done, she wipes down the bathroom with a disinfectant solution before going back to her room.\nAfter a couple of days, Marcos, Anita\u2019s 8 year old son, starts feeling bad too. Then her mother, who lives with them, develops a fever. They both move into the same room with Anita to try to keep the rest of the family safe.\n\nAnita\u2019s husband continues to be the only one in the family who brings food and cares for the three sick family members.\n\nThe room where Anita, her mother, and Marcos stay is small and crowded.\nHappily, it has a door to the outside. David sets up a place outside the door where the three sick family members can rest and enjoy the fresh air.\nAnita and David\u2019s daughters cook and do the laundry to help out.\n\u00a0Some neighbors bring groceries and fever medicines so that the family does not spread the disease by going to the shops themselves. They understand that even people who do not feel sick might have the virus and can spread the illness. They know it is important that Anita and David's whole family stays at home.\nDavid says to the neighbors, \u201cDo not come close to our sick family members! We do not want you to get sick, too. But please do pray for them, sing songs and visit with them from outside the enclosure.\u201d\nThe pastor comes every couple of days to pray for the sick, and encourage them by reading the Scriptures aloud from across the fence. He is careful to wear a mask as well.\nThe Community Health Worker, Maria, has taught David how to care for his sick family. He knows to give them fever medicine when they need it.\n\nWhen they cannot eat much, he feeds them simple hot broth and soup. His daughters help by cooking the broth.\nHis mother-in-law, Flora, gets so ill that she cannot eat anything.\nSo, David\u00a0 mixes 8 teaspoons of sugar and 1/2 teaspoon of salt in a liter of clean water for Flora to drink. He tries to make sure that they all drink two liters of liquid per day.\nAfter several days of being very sick, Anita begins to feel better. Her son, Marcos, does not get very sick and recovers very quickly.\nFlora, Anita\u2019s mother, starts to feel better for a couple of days, too, but then she gets sicker again. Her fever goes up and she begins to have difficulty breathing.\n\nAnita is scared for her mother. She says to David, \u201cWe need to take Mama to the Doctor!\u201d\n\nDavid replies, \u201cI wish we could. But because of the lockdown there are no buses running. Even Maria, our Community Health Worker, can\u2019t come!\"\nThankfully, Anita is able to call Maria on the phone to get some advice about how to take care of her mother.\nMaria tells her, \u201cRemember that all of you still need to quarantine from the rest of the community to keep from spreading the disease. There are ways you can help your mother even if you cannot go out.\u201d\nShe says to Anita, \u201cYou can now care for your mother since you have already had Covid-19 and it is unlikely that you will get it again right away. Also, Flora\u2019s room needs to be well-ventilated and she needs to keep drinking liquids\". Maria is glad to hear that the room has a door to the outside, which can be opened to let air inside.\n\nDavid opens the door and puts a screen curtain up so that the air can come in but the flies stay outside. When the door is shut, David makes sure the window is open because the fresh air helps Flora to breathe more easily.\n\nAnita helps her mother take sips of water at least every hour.\nAnita learns from Maria to have her mother take some deep, slow breaths every hour. This helps Flora keep her lungs working properly.\nAnita also helps Flora change her position often. She tries to have Flora lie on her stomach whenever she can because that also helps Flora\u2019s lungs.\nMaria also teaches Anita another way to help Flora\u2019s lungs, by making a bubble bottle.\nFirst Anita fills a coke bottle with about 5 centimeters of water and puts a straw into the bottle.\nThen Flora blows gently into the straw to make the water bubble. Doing this several times every couple of hours helps her lungs work better.\nAnita is thankful for all of Maria's advice. Flora slowly begins to feel better and gets her strength back.\nThe family keeps track of the days since Anita, Marco and Flora first got sick. Finally, after 14 days, they check their\u00a0temperatures. None of them have had a fever for at least 24 hours, and they are able to go out of the\u00a0house again.They will not spread the sickness anymore.\nAnita hopes she can see Maria, the Community Health Worker, again soon. She wants to thank her for all she\u2019s taught Anita and the rest of the community. David and Anita are glad to know that they took care of their family in the best possible ways even though they could not go and get medical help in person.\n\nMany others in their community have Covid-19. Anita and David have learned so much that now they can help them and their families.\nTheir church has been able to encourage people by praying and bringing food. They also help with funerals of people who have died from the virus and give comfort to the grieving families and community.\nEveryone is looking forward to when they can get the vaccine to protect against Covid-19. Thankfully, while they wait, they know what to do.\n\n"
    },
    "brandingProjectName": "Default",
    "contentLanguages": [
        "eng"
    ],
    "copyright": null,
    "country": "",
    "credits": "Adapted with permission from COVID-19 Home Based Care: How to do it best for the patient and the family, 2020, Difaem - German Institute for Medical Mission, www.difaem.\r\n\r\n\r\n\r\n\r\n\r\n\r\n\r\n\r\n\r\nThis resource has been developed using reputable public health sources for educational purposes only. It is not a substitute for professional medical advice. For questions or concerns about any topic described here, please consult a health professional.\r\n",
    "district": "",
    "features": [],
    "folio": false,
    "imported-book-source-url": null,
    "internetLimits": null,
    "isRtl": false,
    "isbn": "",
    "langPointers": [
        {
            "__type": "Pointer",
            "className": "language",
            "objectId": "vTo23jVYzz"
        }
    ],
    "language-display-names": {
        "en": "English",
        "es": "Espa\u00f1ol"
    },
    "languages": [],
    "license": "cc-by",
    "licenseNotes": null,
    "originalPublisher": "",
    "originalTitle": "A Family\u2019s Experience with COVID-19 at Home",
    "page-number-style": "Decimal",
    "pageCount": 33,
    "phashOfFirstContentImage": null,
    "province": "",
    "publisher": "",
    "readingLevelDescription": null,
    "subjects": null,
    "suitableForMakingShells": false,
    "suitableForMakingTemplates": false,
    "suitableForVernacularLibrary": true,
    "summary": "Easily understood and accurate guidance for families and communities who must care for COVID-19 patients at home without medical help.",
    "tags": [
        "topic:Health"
    ],
    "title": "A Family\u2019s Experience\nwith COVID-19 at Home",
    "typicalAgeRange": null,
    "use-original-copyright": false
}